{
  "$schema": "https://json-schema.org/draft/2020-12/schema",
  "$id": "https://openclaw.local/schemas/pipeline-result.schema.json",
  "title": "Video Pipeline Result",
  "type": "object",
  "additionalProperties": false,
  "required": [
    "schema_version",
    "status",
    "failed_stage",
    "agent_id",
    "failure_kind",
    "errors",
    "warnings",
    "last_valid_artifacts",
    "result"
  ],
  "properties": {
    "schema_version": {
      "const": "1.0"
    },
    "status": {
      "enum": [
        "COMPLETE",
        "MEDIA_WAIT",
        "BLOCKED",
        "FAILED"
      ]
    },
    "failed_stage": {
      "type": [
        "string",
        "null"
      ]
    },
    "agent_id": {
      "oneOf": [
        {
          "enum": [
            "story-analyst",
            "shot-director",
            "frame-designer",
            "h3-compiler",
            "h3-validator"
          ]
        },
        {
          "type": "null"
        }
      ]
    },
    "failure_kind": {
      "oneOf": [
        {
          "enum": [
            "subagent_start_failed",
            "subagent_run_failed",
            "deterministic_validation_failed",
            "semantic_validation_failed",
            "media_wait",
            "repair_exhausted"
          ]
        },
        {
          "type": "null"
        }
      ]
    },
    "errors": {
      "type": "array",
      "items": {
        "$ref": "#/$defs/diagnostic"
      }
    },
    "warnings": {
      "type": "array",
      "items": {
        "$ref": "#/$defs/diagnostic"
      }
    },
    "last_valid_artifacts": {
      "type": "object"
    },
    "result": {
      "type": [
        "object",
        "null"
      ]
    }
  },
  "allOf": [
    {
      "if": {
        "properties": {
          "status": {
            "const": "COMPLETE"
          }
        },
        "required": [
          "status"
        ]
      },
      "then": {
        "properties": {
          "failed_stage": {
            "type": "null"
          },
          "agent_id": {
            "type": "null"
          },
          "failure_kind": {
            "type": "null"
          },
          "errors": {
            "maxItems": 0
          },
          "result": {
            "type": "object"
          }
        }
      }
    },
    {
      "if": {
        "properties": {
          "status": {
            "enum": [
              "BLOCKED",
              "FAILED"
            ]
          }
        },
        "required": [
          "status"
        ]
      },
      "then": {
        "properties": {
          "failed_stage": {
            "type": "string",
            "minLength": 1
          },
          "failure_kind": {
            "type": "string"
          },
          "errors": {
            "minItems": 1
          }
        }
      }
    },
    {
      "if": {
        "properties": {
          "failure_kind": {
            "enum": [
              "subagent_start_failed",
              "subagent_run_failed"
            ]
          }
        },
        "required": [
          "failure_kind"
        ]
      },
      "then": {
        "properties": {
          "agent_id": {
            "enum": [
              "story-analyst",
              "shot-director",
              "frame-designer",
              "h3-compiler",
              "h3-validator"
            ]
          }
        }
      }
    },
    {
      "if": {
        "properties": {
          "status": {
            "const": "MEDIA_WAIT"
          }
        },
        "required": [
          "status"
        ]
      },
      "then": {
        "properties": {
          "failure_kind": {
            "const": "media_wait"
          },
          "result": {
            "type": "object",
            "required": [
              "draft_video_prompts",
              "pending_media_ids"
            ],
            "properties": {
              "draft_video_prompts": {
                "type": "array",
                "minItems": 1,
                "items": {
                  "$ref": "#/$defs/draftPromptResult"
                }
              },
              "pending_media_ids": {
                "type": "array",
                "description": "The reference media the run is waiting on: every static medium in the manifest without a path or runtime handle.",
                "items": {
                  "type": "string",
                  "minLength": 1
                },
                "uniqueItems": true
              }
            }
          }
        }
      }
    },
    {
      "if": {
        "properties": {
          "status": {
            "enum": [
              "COMPLETE",
              "MEDIA_WAIT"
            ]
          }
        },
        "required": [
          "status"
        ]
      },
      "then": {
        "properties": {
          "result": {
            "type": "object",
            "required": [
              "total_duration",
              "aspect_ratio"
            ],
            "properties": {
              "total_duration": {
                "type": "integer",
                "minimum": 1
              },
              "aspect_ratio": {
                "type": [
                  "string",
                  "null"
                ]
              }
            }
          }
        }
      }
    }
  ],
  "$defs": {
    "diagnostic": {
      "type": "object",
      "additionalProperties": false,
      "required": [
        "code",
        "path",
        "message",
        "retryable"
      ],
      "properties": {
        "code": {
          "type": "string",
          "minLength": 1
        },
        "path": {
          "type": "string"
        },
        "message": {
          "type": "string",
          "minLength": 1
        },
        "retryable": {
          "type": "boolean"
        }
      }
    },
    "draftPromptResult": {
      "type": "object",
      "required": [
        "segment_id",
        "prompt",
        "symbolic_media_mapping"
      ],
      "properties": {
        "segment_id": {
          "type": "string",
          "minLength": 1
        },
        "prompt": {
          "type": "string",
          "minLength": 1
        },
        "symbolic_media_mapping": {
          "type": "object"
        }
      }
    }
  }
}
